chapter,question,options,correct-answer,note,page,difficulty
6,"To turn left from a one-way street onto a one-way street, start from:","""a: The lane closest to the left curb., b: The center lane., c: Any lane""","""a""","""According to page 21, 'To turn left from a one-way street onto a one-way street. Start the turn from the far-left lane.'""",21,easy
6,"To turn left from a one-way street with multiple lanes onto a two-way street, start the turn in:","""a: The far left lane., b: Any available lane., c: The lane closest to the middle of the street.""","""a""","""The DMV handbook states that to turn left from a one-way street onto a two-way street, you should start the turn from the far-left lane. This is to reduce the risk of collision.""",21,easy
6,"When turning left from a two-way street onto a one-way street, you should:","""a: Turn into any lane., b: Turn into first lane., c: Turn into second lane.""","""a""","""According to page 21 of the DMV handbook, 'If there are three or more lanes in your direction of travel, you may end your turn in any lane that is open.'""",21,easy
6,You are merging onto an interstate highway. You should:,"""a: Select a safe gap and merge into the lane of traffic., b: Merge across two lanes at once., c: Always stop before entering the highway.""","""a""","""The DMV handbook states that 'When you enter a highway, you will need to... Merge into highway traffic when safe to do so. Do not stop unless absolutely necessary.'""",22,easy
6,"When you enter a freeway from an on ramp and merge with traffic, you should be driving at","""a: The legal speed limit on the freeway, b: About the same speed as the freeway traffic, c: About 10 m.p.h. slower than the freeway speed limit""","""b""","""The DMV handbook states that when merging onto a highway, 'Be in the proper lane on the on-ramp. - Be at or near the speed of traffic.'""",23,easy
6,"If you are leaving a parking lot, you","""a: Must turn either left or right only when it is safe, b: Have the right-of-way, c: Must yield to traffic before re-entering the road""","""c""","""When entering traffic from a full stop, signal and leave a large enough space to get up to the speed of traffic.  To merge, enter, or exit traffic, you need a space that is:  - Half a block on city streets, which is about 150 feet.  - A full block on the highway, which is about 300 feet.""",23,easy
6,"If you have a green light, but traffic is blocking the intersection, you should","""a: Enter the intersection and wait until traffic clears, b: Merge into another lane and try to go around the traffic, c: Stay out of the intersection until traffic clears""","""c""","""Even if you have a green light, do not start across the intersection if there are pedestrians or vehicles blocking your pathway.  'It is against the law to stop or block an intersection where there is not enough space to completely cross before the traffic signal light turns red.'""",23,easy
6,A vehicle that enters a road from a driveway,"""a: Has the right-of-way, b: Must stop and yield the right-of-way to traffic on the roadway and to pedestrians, c: Must yield to traffic approaching from the right while it has the right-of-way over vehicles approaching from the left""","""b""","""According to the DMV handbook,  'When entering traffic, you must proceed with caution and yield to the traffic already occupying the lanes.' (Page 23) Therefore, a vehicle entering a roadway from a driveway must stop and yield the right-of-way to vehicles already on the roadway and to pedestrians.""",23,easy
6,"When you are merging onto the freeway, you should be driving","""a: at or near the same speed as the traffic on the freeway, b: 5 to 10 mph slower than the traffic on the freeway, c: The posted speed limit for traffic on the freeway""","""a""","""The DMV handbook states 'Be in the proper lane on the on-ramp. - Be at or near the speed of traffic. - Merge into highway traffic when safe to do so. Do not stop unless absolutely necessary.' """,23,easy
6,How long before changing lanes on a freeway should you signal?,"""a: 1-2 seconds, b: 2-4 seconds, c: 3-5 seconds""","""c""","""The California Driver's Handbook states, 'Signal at least five seconds before you change lanes on a freeway.' This is the same as 'approximately 400 feet'.""",23,easy
6,You are driving on the freeway and need to exit. You should:,"""a: Use your turn signal and move into the exit lane, b: Exit immediately without signaling, c: Accelerate into the exit lane, d: None of the above""","""a""","""To exit a highway safely, you should know your exit and be aware of when it is approaching. If you plan to change lanes, do so one at a time. Signal and look over your shoulder to check your blind spots. When in the proper lane, signal five seconds (approximately 400 feet) before you exit.""",23,easy
6,"If you miss your exit on the freeway, you should not:","""a: Continue on the freeway and find an alternate route to your destination., b: Proceed to the next exit, c: Back up on the road or shoulder.""","""c""","""According to the DMV Handbook, page 23,  'If you miss your exit, continue around until you return to your exit.'  Therefore, option 'c' is the incorrect answer.""",23,easy
6,"If you want to enter the freeway but you don't see a gap in traffic, you should:","""a: Maintain your speed and force the other drivers to create a gap., b: Slow down on the ramp to wait for a gap., c: Stop at the end of the ramp to wait for a gap.""","""b""","""You should 'Slow down on the ramp to wait for a gap.' as stated on page 23 of the DMV Handbook. It says that when entering a highway, you should 'Be at or near the speed of traffic... Merge into highway traffic when safe to do so. Do not stop unless absolutely necessary.'""",23,easy
6,To enter a gap in highway traffic:,"""a: Watch only the vehicles behind the gap., b: Check behind you, c: Speed up and let the other vehicles make way.""","""b""","""To merge into a space large enough for your vehicle to safely join the lane, use your mirrors and turn signals. 'Turn your head quickly to look over your shoulder before changing lanes or merging into traffic.'""",23,easy
6,"When entering an interstate highway, you should:","""a: Stop, b: Check for cars and reduce your speed to 25 mph before entering the traffic lane., c: Check for cars""","""c""","""When entering a highway, you will need to: Be in the proper lane on the on-ramp, Be at or near the speed of traffic, Merge into highway traffic when safe to do so. Do not stop unless absolutely necessary.""",23,easy
6,"When entering the interstate on a short entrance ramp where there is no acceleration lane, you should:","""a: Immediately enter the far-right traffic lane on the interstate and speed up to match the flow of traffic., b: Use the shoulder of the main road to get up to the speed of traffic., c: Speed up and enter the interstate only after you have identified a gap in traffic.""","""c""","""The correct answer is 'c: Speed up and enter the interstate only after you have identified a gap in traffic.'. The DMV handbook states, 'When you enter a highway, you will need to...Be at or near the speed of traffic...Merge into highway traffic when safe to do so. Do not stop unless absolutely necessary.'""",23,medium
6,"When entering the interstate, check for a gap in traffic in the nearest lane, adjust your speed to match traffic, signal, and:","""a: Expect traffic to allow you to proceed into the lane, b: Merge carefully into the gap., c: Wait for the lane to clear before merging.""","""b""","""The DMV handbook states that when entering a highway, you should 'Merge into highway traffic when safe to do so. Do not stop unless absolutely necessary.' The correct answer is to 'Merge carefully into the gap.' """,23,easy
6,"When entering traffic after being parked at a curb, you:","""a: Should drive more slowly than other traffic for 200 feet., b: Should wait for a large enough gap to get up to the speed of traffic., c: Should wait for the first two vehicles to pass""","""b""","""The DMV handbook states that when entering traffic from a full stop, signal and leave a large enough space to get up to the speed of traffic.""",23,easy
6,You are entering a freeway. Check traffic on the freeway by:,"""a: Using your rearview and side mirrors., b: Using your rearview mirror., c: Using your side mirror and looking over your shoulder.""","""c""","""Before you enter a highway, you will need to...Merge into highway traffic when safe to do so. Do not stop unless absolutely necessary.  Use your mirrors and turn signals.  Turn your head quickly to look over your shoulder before changing lanes or merging into traffic.""",23,easy
6,You are preparing to exit the interstate. When should you start reducing your speed?,"""a: About halfway through the deceleration lane., b: As you approach the deceleration lane., c: Immediately upon entering the deceleration lane.""","""b""","""According to the DMV handbook, 'When in the proper lane, signal five seconds (approximately 400 feet) before you exit.' This indicates that you should start reducing your speed as you approach the deceleration lane, allowing ample time for a safe exit.""",23,easy
6,"You were parked and have been waiting a long time with your turn signal on to re-enter traffic. However, traffic is heavy. You should:","""a: Continue waiting and yielding to traffic in the lane., b: Slowly inch your vehicle into the traffic lane., c: Drive on the shoulder until a gap in traffic appears.""","""a""","""You should 'Continue waiting and yielding to traffic in the lane.'  The DMV handbook states that when entering traffic from a full stop, you must 'leave a large enough space to get up to the speed of traffic.' (Page 23)""",23,medium
6,"If a traffic signal is green, but traffic is blocking the intersection, what should you do?","""a: Partially enter the intersection as allowed by traffic., b: Wait and do not enter the intersection until your vehicle can get completely across., c: Drive around the traffic on the shoulder to help ease the congestion.""","""b""","""Even if you have a green light, do not start across the intersection if there are pedestrians or vehicles blocking your pathway. 'It is against the law to stop or block an intersection where there is not enough space to completely cross before the traffic signal light turns red.'""",24,easy
6,"You are approaching a green traffic light, but traffic is blocking the intersection. What is the best thing to do?","""a: Partially enter the intersection to establish your right-of-way, b: Continue into the intersection and wait for traffic to clear, c: Don't enter the intersection until you can get completely across""","""c""","""Even if you have a green light, do not start across the intersection if there are pedestrians or vehicles blocking your pathway. It is against the law to stop or block an intersection where there is not enough space to completely cross before the traffic signal light turns red.""",24,easy
6,You should not pass another vehicle,"""a: On a multi-lane one-way street, b: Where someone is likely to enter or cross the road, c: When a broken yellow line is on the left side of your lane""","""b""","""You should not pass another vehicle when someone is likely to enter or cross the road. 'Do Not Pass: At crossroads and driveways. - Unless you have enough space to return to your lane.'""",24,easy
6,If an oncoming vehicle has started to turn left in front of you,"""a: Maintain your speed and take your right of way, b: Honk your horn to warn the driver and maintain your speed, c: Slow or stop to prevent a collision""","""c""","""When turning left, do not assume that an oncoming vehicle with its right turn signal on is turning before it reaches you. The driver may have their signal on by mistake or plan to turn just beyond you. Wait for the vehicle to start its turn before beginning the left turn.""",24,medium
6,"You are approaching a green traffic light, but traffic is blocking the intersection. What is the best thing to do?","""a: Partially enter the intersection to establish your right of way., b: Continue into the intersection and wait for traffic to clear., c: Don't enter the intersection until you can get completely across., d: None of the above""","""c""","""Even if you have a green light, do not start across the intersection if there are pedestrians or vehicles blocking your pathway. 'It is against the law to stop or block an intersection where there is not enough space to completely cross before the traffic signal light turns red.'""",24,easy
6,You may drive off the paved roadway to pass another vehicle,"""a: if the shoulder is wide enough to accommodate your vehicle, b: if the vehicle ahead of you is turning left, c: under no circumstances""","""c""","""According to the DMV Handbook, 'Never drive off the paved or main-traveled part of the road to pass.'""",24,easy
6,You want to pass a vehicle on the road. You should,"""a: Wait until you can see the entire vehicle in your rearview mirror before merging back into your lane, b: Use your horn to alert the other driver of your intention to pass, c: Pass only if there is enough space in the lane ahead of the vehicle, d: None of the above""","""c""","""The DMV handbook states, 'Unless you have enough space to return to your lane.' This means you should only pass if there is enough space in the lane ahead of the vehicle.""",24,easy
6,"After you have passed a vehicle moving in the same direction, it is safe to move back into the right lane:","""a: After about three seconds., b: When you can no longer see the passed vehicle over your right shoulder., c: When you can see the entire front of the passed vehicle in your rearview mirror.""","""c""","""According to page 24 of the DMV handbook, 'Never pass on the left if the driver is signaling a left turn. ... Unless you have enough space to return to your lane.' This indicates that you should only return to your lane when you can safely see the vehicle you have passed in your rearview mirror. Option 'c' is the most accurate description of this situation.""",24,medium
6,"As you approach the top of a hill, you should:","""a: Speed up slightly., b: Prepare to stop, c: Maintain a steady speed.""","""b""","""You should prepare to stop as you approach the top of a hill because you may not be able to see what is ahead.  The DMV handbook states: 'Do not pass if you are approaching a hill or curve and cannot see if other traffic is approaching. This is very dangerous on one and two lane roads.'""",24,easy
6,"If you are facing a green traffic light but the intersection ahead is blocked by traffic, you should:","""a: Turn left and find another route., b: Stay out of the intersection until traffic clears., c: Follow the other vehicles and enter the intersection.""","""b""","""Even if you have a green light, do not start across the intersection if there are pedestrians or vehicles blocking your pathway. It is against the law to stop or block an intersection where there is not enough space to completely cross before the traffic signal light turns red.""",24,easy
6,"If you plan to pass another vehicle, you should:","""a: Not assume the other driver will make space for you to return to your lane., b: Assume the other driver will let you pass if you use your turn signal., c: Assume the other driver will maintain a constant speed.""","""a""","""The DMV handbook states, 'Before you pass, look ahead for road conditions that may cause other vehicles to move into your lane.'  This means you should 'Not assume the other driver will make space for you to return to your lane.' """,24,medium
6,It is unlawful to:,"""a: Pass another vehicle in any marked no passing zone., b: Pass another vehicle over a railroad crossing., c: Both of the above.""","""c""","""The DMV handbook states on page 24, 'You must judge whether you have enough space to pass whenever you approach...a railroad crossing.' and, 'Do Not Pass...Within 100 feet of an intersection, bridge, tunnel, railroad crossing, or other hazardous area.' Therefore, the answer is both.""",24,easy
6,"To pass on a two-lane road, you should:","""a: Sound your horn as you pass., b: Flash your headlights as you pass., c: Judge the distance to any oncoming vehicles.""","""c""","""To safely pass, you must judge whether you have enough space to pass whenever you approach:  - An oncoming vehicle or bicyclist.  - A hill, curve, intersection, or road obstruction.  To safely pass, the hill or curve should be at least one-third of a mile ahead.""",24,easy
6,When passing another vehicle:,"""a: Pass the vehicle as slowly as possible., b: Drive at the same speed as the vehicle you are passing., c: Pass the vehicle as safely and as quickly as possible.""","""c""","""The DMV handbook states that when passing another vehicle, you should 'speed up to pass the vehicle.' This means that you should pass the vehicle as safely and as quickly as possible.""",24,easy
6,Where is it safe to pass another vehicle?,"""a: Within an intersection where there are no oncoming vehicles, b: Wherever signs and/or pavement markings permit passing, c: Within a curve where there are no oncoming vehicles""","""b""","""The DMV handbook states on page 24 that, 'You must judge whether you have enough space to pass whenever you approach: An oncoming vehicle or bicyclist., A hill, curve, intersection, or road obstruction.'  The DMV handbook explains on page 24, 'To safely pass, the hill or curve should be at least one-third of a mile ahead.'""",24,medium
6,You are approaching a green traffic light and traffic is blocking the intersection. What is the best thing to do?,"""a: Partially enter the intersection to establish your right-of-way., b: Don't enter the intersection until you can get completely across., c: Continue into the intersection and wait for traffic to clear.""","""b""","""Even if you have a green light, do not start across the intersection if there are pedestrians or vehicles blocking your pathway.  It is against the law to stop or block an intersection where there is not enough space to completely cross before the traffic signal light turns red.""",24,easy
6,When it is legal to drive off the road to pass another vehicle?,"""a: If the vehicle ahead is turning left., b: It is not legal under any conditions., c: If there are two or more one-way lanes.""","""b""","""According to the DMV Handbook, 'Never drive off the paved or main-traveled part of the road to pass.' (Page 25)""",25,medium
6,Coasting with the gear shift in neutral is,"""a: Recommended in the mountains, b: Safe and conserves gas, c: Against the law""","""c""","""Coasting with the gear shift in neutral is against the law. 'Never drive off the paved or main-traveled part of the road to pass.' This is a dangerous practice.""",25,medium
6,"If you are being passed in a no passing zone, you should:","""a: Pull off the road., b: Maintain your speed and position., c: Slow down and let the other driver safely return to the drive lane.""","""b""","""If a vehicle is passing you or signals that they plan on passing, allow the vehicle to pass. Maintain your lane position and your speed.""",25,medium
6,"When passing on the left of a vehicle, it is safe to move back into the right lane:","""a: After about three seconds., b: When you can no longer see the vehicle over your right shoulder., c: When you can see the front of the vehicle in your rearview mirror.""","""c""","""The DMV handbook states that you should return to your original lane when you can see the front of the vehicle in your rearview mirror.  This indicates you have safely passed the vehicle and can return to your lane.""",25,medium
6,"When passing, you should move back into the right lane when:","""a: You are one vehicle length ahead of the passed vehicle., b: You can see both headlights of the passed vehicle in your rearview mirror., c: You are 50 feet ahead of the passed vehicle.""","""b""","""According to the DMV Handbook, you should move back into the right lane when you can see both headlights of the passed vehicle in your rearview mirror. 'Signal and return to your original lane.'""",25,easy
6,Which of the following is the proper procedure for parallel parking?,"""a: Drive forward into the space without stopping., b: Stop next to the vehicle behind the open space and then drive forward into the space., c: Stop next to the vehicle in front of the open space and then back into the space.""","""c""","""The DMV handbook describes the steps for parallel parking on page 26. The correct answer is option c, 'Stop next to the vehicle in front of the open space and then back into the space.'""",26,easy
6,"In addition to setting your parking brake, what should you do when parking on a hill?","""a: Make sure the front vehicle wheels are parallel to the road., b: Make sure your vehicle is left in the 'neutral' position., c: Make sure your vehicle is in the 'park' position or in gear.""","""c""","""When you park on a hill, your vehicle could roll due to equipment failure.  Remember to set the parking brake and leave the vehicle in park, or in gear for manual transmission.""",26,easy
6,When parking your vehicle on any hill,"""a: Your front wheels should be parallel to the road if there is no curb, b: Use your parking brake and leave the vehicle in gear or 'park', c: One of your rear wheels should touch the curb""","""b""","""To prevent your vehicle from rolling, you must 'set the parking brake and leave the vehicle in park, or in gear for manual transmission.'""",26,easy
6,"To safely back their vehicle, drivers should NOT","""a: Tap their horn before backing up, b: Check in front and behind their vehicle before they get in, c: Look over their right shoulder as they back up""","""b""","""Before backing up, it is important to check for hazards in front and behind the vehicle. 'Observe traffic and check appropriate blind spots.' (Page 26)""",26,easy
6,Parallel parking is when the,"""a: front wheels are turned toward the street, b: vehicle is in line with other parked vehicles, c: rear wheels are touching the curb""","""b""","""Parallel parking is defined as parking 'in line with the road and other parked vehicles'.  The DMV handbook states that on page 26: 'Parallel parking is when you park in line with the road and other parked vehicles.'""",26,easy
6,"When you park on a hill, your vehicle could roll due to an equipment failure. Remember","""a: leave the vehicle in neutral, b: set the parking brake, c: set the parking brake and leave the vehicle in park""","""c""","""The DMV Handbook states: 'Remember to set the parking brake and leave the vehicle in park, or in gear for manual transmission.'""",26,easy
6,Backing your vehicle is:,"""a: Always dangerous to do., b: Dangerous if you have a helper., c: Only dangerous in large vehicles.""","""a""","""The DMV handbook states that 'Stay aware of what is behind you when backing up.' This implies backing up is always dangerous.  'To back up in a straight line: 1. Traffic check. Observe traffic and check appropriate blind spots.'""",26,easy
6,If you parallel park facing downward on a hill:,"""a: Turn your wheels sharply toward the side of the road., b: Turn your wheels away from the side of the road., c: Keep your wheels straight.""","""a""","""To park on a hill headed downhill, turn your front wheels into the curb or right toward the side of the road.""",26,medium
6,When backing up:,"""a: Look through the rear window., b: Press hard on the gas pedal., c: Rely only on your rearview mirror.""","""a""","""When backing up, 'To back up in a straight line: 1. **Traffic check.** Observe traffic and check appropriate blind spots., 2. **Signal.** Activate the turn signal before pulling up to the curb. Cancel the turn signal once completed., 3. **Check your blind spots.** Look in your rearview mirror and over your shoulder for approaching vehicles and pedestrians., 4. **Begin backing up.** Back in a straight line for three vehicle lengths while remaining within three feet of the curb. Stay aware of what is behind you when backing up., 5. **Control.** To maintain control of the vehicle, back at a smooth, safe speed and adjust the steering wheel when needed. Practice until you can keep the vehicle straight. Repeat steps 1 and 2 to pull away from the curb.'""",26,easy
6,When parking your vehicle parallel to the curb on a level street:,"""a: Your front wheels must be turned toward the street., b: Your wheels must be within 18 inches of the curb., c: One of your rear wheels must touch the curb.""","""b""","""According to the DMV handbook, when parallel parking your vehicle, 'Your vehicle should now be parallel and within 18 inches of the curb.'""",26,easy
6,"Left sign or the lane and sign should be used to warn of the reduction in the number of traffic lanes in the direction of travel on a multi lane highway. When parking uphill on a 2 way street with no curb, your front wheels should be","""a: Turn to the left toward the street, b: Turn to the right away from the street, c: Parallel with the pavement, d: Turn the wheels toward the curb""","""b""","""To prevent rolling downhill when parked on a hill with no curb, turn your front wheels to the right away from the street. 'Headed uphill: Turn your front wheels away from the curb (left - towards the center of the road) and let your vehicle roll back a few inches. The wheel should gently touch the curb. '""",27,medium
