chapter,question,options,correct-answer,note,page,difficulty
7,Increase your following distance when driving behind a large vehicle:,"""a: To better see around the sides of the vehicle., b: Because other drivers tend to pull behind large vehicles before trying to pass them., c: Because following too closely will get you caught in the vehicle's slipstream.""","""c""","""The DMV Handbook states on page 42: 'Tailgating decreases a vehicle's safety distance.'""",42,easy
7,Large trucks turning onto a street with two lanes in each direction:,"""a: May complete the turn in either of the two lanes., b: Often have to use the left lane to complete the turn., c: Must stay in the right lane at all times while turning.""","""b""","""The correct answer is **b**, 'Often have to use the left lane to complete the turn.'  The DMV Handbook states on page 42: 'When a vehicle turns, the rear wheels follow a shorter path than the front wheels. The longer the vehicle, the greater the difference in the length of the turning path. This is why large vehicles and truck drivers must often swing wide to complete a turn.'""",42,medium
7,Stopping distances and severity of crashes:,"""a: Decrease as vehicle speed increases., b: Are not affected by vehicle speed., c: Increase as vehicle speed increases.""","""c""","""The DMV handbook states: 'The heavier the vehicle and the faster it is moving, the longer it takes to safely stop, so a loaded truck will take longer to stop than an empty truck.'""",42,easy
7,Which of the following statements about blind spots is true?,"""a: They are eliminated if you have one outside mirror on each side of the vehicle., b: Large trucks have bigger blind spots than most passenger vehicles., c: Blind spots can be checked by looking in your rearview mirrors.""","""b""","""The DMV handbook states that large vehicles and truck drivers have a better view in front of them and bigger mirrors, but they also have large blind spots, also called No Zones.  'In these areas, your vehicle can disappear from a large vehicle or truck driver's view. If you cannot see the truck's side mirrors, the truck driver cannot see you.'""",42,easy
7,Which of these statements is true about large trucks?,"""a: They take longer to stop than passenger vehicles., b: They all have air brakes that allow them to stop quickly., c: They are more maneuverable than passenger vehicles.""","""a""","""Large vehicles and commercial trucks take longer to stop than passenger vehicles traveling at the same speed.""",42,easy
7,You should not make sudden stops in front of large trucks and buses because:,"""a: Small vehicle drivers cannot adequately see large trucks and buses in their rearview mirrors., b: Large trucks and buses, c: Large trucks and buses travel at a higher speeds than small vehicles.""","""b""","""Large vehicles take longer to stop than passenger vehicles traveling at the same speed.  'The average passenger vehicle traveling at 55 mph can stop within 300 feet. A large vehicle traveling at the same speed can take up to 400 feet to stop. The heavier the vehicle and the faster it is moving, the longer it takes to safely stop, so a loaded truck will take longer to stop than an empty truck. Do not The shaded areas in this  image are the truck driver's blind spots. move in front of a large vehicle and suddenly slow down or stop. The large vehicle will not be able to stop fast enough to avoid crashing into you.'""",42,medium
7,A safety zone is a specially marked area for passengers to get on or off of buses or trolleys. You may not drive through a safety zone:,"""a: When a bus or trolley is present., b: When a bus or trolley is unloading passengers., c: At any time for any reason.""","""c""","""The DMV handbook states that 'Safety zones are spaces set aside for pedestrians waiting for buses, streetcars, and trolleys.' It then goes on to say, 'Do not drive through a safety zone under any condition.'""",43,easy
7,"If you want to pass a pedestrian who is walking along the roadway and an oncoming vehicle is approaching, you should:","""a: Slow down and let the oncoming vehicle pass before you pass the pedestrian., b: Keep driving at a steady speed. The oncoming vehicle must stop for you., c: Honk your horn to get the pedestrian to move over.""","""a""","""The correct answer is **a**.  The DMV handbook states that if you are on a two-lane road with an oncoming vehicle and a pedestrian, you should 'take one danger at a time'.  This means you should slow down and allow the oncoming vehicle to pass before attempting to pass the pedestrian. 'If there is a steady flow of oncoming vehicles, use as much of the left lane as you safely can to pass the bicyclist.' (Page 43)""",43,medium
7,You must always look carefully for motorcycles before you change lanes or make a left turn because they,"""a: Have the right-of-way, b: Are hard to see, c: Are driven too fast""","""b""","""The DMV handbook states on page 44, 'Motorcycles are smaller in size and harder to see so they easily disappear in vehicle blind spots.'  Therefore, the correct answer is **b**.""",44,easy
7,"When you hear the siren or see the red emergency light of a closely approaching ambulance, police vehicle, or fire truck, you must","""a: Drive to the right edge of the road and stop, b: Move in to the right lane and drive slowly until has passed, c: Speed up to clear traffic""","""a""","""According to the DMV handbook, page 44, you must 'Give the right-of-way to any law enforcement vehicle, fire engine, ambulance, or other emergency vehicle using a siren and red lights. Drive to the right edge of the road and stop until the emergency vehicle(s) have passed.'""",44,easy
7,"When following a motorcycle, drivers must remember that motorcycles can ____________ than other vehicles.","""a: Accelerate much faster, b: Stop much more quickly, c: Stop much more slowly""","""b""","""According to the DMV handbook on page 44, 'Allow a safe three-second following distance. This space will help you avoid hitting a motorcyclist if they brake suddenly or fall.'""",44,easy
7,Which statement is true about motorcyclists and motorists?,"""a: Motorcyclists have the same rights/responsibilities as other motorists, b: Motorcyclists are heavier than other vehicles and are less affected by wind/rain, c: Motorcyclists are not allowed to drive faster than other traffic during congested road conditions""","""a""","""Motorcyclists have the same rights and responsibilities as other vehicle drivers. 'Motorcyclists have the same rights and responsibilities as other vehicle drivers.' - DMV Handbook, Page 44""",44,easy
7,You must yield the right of way to an emergency vehicle by:,"""a: Driving as near to the right edge of the road as possible and stopping., b: Moving into the right lane and driving slowly until it has passed., c: Stopping immediately even if you are in an intersection.""","""a""","""The DMV handbook states on page 44, 'Give the right-of-way to any law enforcement vehicle, fire engine, ambulance, or other emergency vehicle using a siren and red lights. Failure to pull over may result in a ticket. Drive to the right edge of the road and stop until the emergency vehicle(s) have passed.'""",44,easy
7,You are driving on a city street and see an emergency vehicle with flashing lights behind you. What should you do?,"""a: Drive to the right edge of the road and slow down., b: Drive to the right edge of the road and stop., c: Stay in your lane slow down and let it pass.""","""b""","""According to the DMV Handbook, 'Give the right-of-way to any law enforcement vehicle, fire engine, ambulance, or other emergency vehicle using a siren and red lights. Failure to pull over may result in a ticket. Drive to the right edge of the road and stop until the emergency vehicle(s) have passed.'""",44,easy
7,Always carefully look for motorcycles before you change lanes because:,"""a: Their small size can make them hard to see., b: They usually have the right-of-way at intersections., c: It is illegal for motorcycles to share traffic lanes.""","""a""","""The DMV handbook states, 'Motorcycles are smaller in size and harder to see so they easily disappear in vehicle blind spots.'  This means you should be extra cautious when changing lanes as they can easily be missed.""",44,easy
7,Children on bicycles should be given extra space by motor vehicle operators because:,"""a: They do not have the same physical reflexes as adults., b: They are smaller and more difficult to see than adults., c: Both of the above.""","""c""","""The DMV handbook explains that motorcyclists are smaller and harder to see in blind spots, and they are less protected on the road. This applies to children on bikes as well. """,44,easy
7,If a child is riding a bicycle near your vehicle:,"""a: Beep your horn., b: Expect the child to be in total control of the bicycle., c: Expect the unexpected.""","""c""","""According to the DMV handbook, 'Road conditions can cause motorcyclists to suddenly change speed or direction.'  This applies to children riding bicycles as well.  Children may not always be paying attention or have the same skills as an adult, so expect the unexpected when a child is riding a bicycle near you.""",44,easy
7,It is dangerous to follow a motorcycle too closely because:,"""a: They do not follow the same rules as motor vehicles., b: A motorcycle can stop much faster than a standard vehicle., c: They brake more slowly than motor vehicles.""","""b""","""According to page 44, 'Allow a safe three-second following distance. This space will help you avoid hitting a motorcyclist if they brake suddenly or fall.'""",44,easy
7,"Motorcycles, scooters, and mopeds are not easy to see; therefore, you should:","""a: Slow down when driving., b: Make constant visual checks., c: Share a lane with a motorcycle.""","""b""","""The DMV handbook states, 'Motorcycles are smaller in size and harder to see so they easily disappear in vehicle blind spots.' Therefore, 'Make constant visual checks.' is the correct answer. """,44,easy
7,When driving on gravel or dirt roads:,"""a: Your tires grip the road better than when you are driving on pavement., b: Your tires do not have as much traction as they do on pavement, c: Visibility is better than on pavement.""","""b""","""The DMV handbook states 'Maintain a safe following distance. This space will help you avoid hitting a motorcyclist if they brake suddenly or fall.'""",44,easy
7,You are crossing an intersection and an emergency vehicle is approaching while using its siren and flashing lights. You should:,"""a: Stop immediately in the intersection until it passes., b: Pull to the right of the intersection and stop., c: Continue through the intersection""","""b""","""According to the DMV Handbook, 'Give the right-of-way to any law enforcement vehicle, fire engine, ambulance, or other emergency vehicle using a siren and red lights. Drive to the right edge of the road and stop until the emergency vehicle(s) have passed.' Therefore, the correct answer is to 'Pull to the right of the intersection and stop.'""",44,easy
7,You are driving on a city street and see an emergency vehicle with flashing lights behind you. What should you do?,"""a: Drive to the right edge of the road and slow down., b: Drive to the right edge of the road and stop., c: Stay in your lane""","""b""","""You must give the right-of-way to any law enforcement vehicle, fire engine, ambulance, or other emergency vehicle using a siren and red lights. 'Drive to the right edge of the road and stop until the emergency vehicle(s) have passed.'""",44,easy
7,You must look for bicyclists in the same lanes used by motor vehicles because they:,"""a: Must ride facing oncoming traffic., b: Illegally share lanes with motor vehicles., c: Are entitled to share the road with motor vehicles.""","""c""","""Motorcyclists have the same rights and responsibilities as other vehicle drivers. 'Bicyclists have the same rights and responsibilities as other drivers.'""",44,medium
7,You must yield the right-of-way to an emergency vehicle that is using its siren and flashing lights by:,"""a: Driving as closely to the right edge of the road as possible and stopping., b: Moving into the right lane and driving slowly until it has passed., c: Stopping immediately""","""a""","""The DMV handbook states on page 44: 'Give the right-of-way to any law enforcement vehicle, fire engine, ambulance, or other emergency vehicle using a siren and red lights. Failure to pull over may result in a ticket. Drive to the right edge of the road and stop until the emergency vehicle(s) have passed.'""",44,easy
7,"When you see a NEV ROUTE sign, you should watch out for","""a: A Nevada law enforcement officer, b: Slow-moving vehicles in the roadway, c: Animal-drawn vehicles""","""b""","""On page 45, the DMV Handbook states, 'Watch for slow-moving vehicles when you see these signs or markings: - NEV USE ONLY - NEV ROUTE. NEVs and LSVs reach a maximum speed of 25 mph.'""",45,easy
7,An orange and red triangular sign on a vehicle always means:,"""a: The vehicle has the right-of-way., b: Slow-moving vehicle., c: Shoulder work ahead.""","""b""","""The DMV handbook states on page 45 that 'Some slow-moving vehicles have an orange and red triangle on their back, such as road maintenance vehicles which usually travel at 25 mph or less.'""",45,medium
7,Large trucks are likely to lose speed when:,"""a: Driving up long or steep hills., b: Driving in long, c: Driving down long""","""a""","""Large trucks, bicycles, and some cars lose speed on long or steep hills. 'Large trucks, bicycles, and some cars lose speed on long or steep hills.'""",45,easy
7,"When you see an emergency vehicle approaching while using its flashing lights, you must:","""a: Maintain your speed and stay in your lane until the vehicle has passed., b: Move into the right lane and drive slowly until the vehicle has passed., c: Pull over to the curb or edge of the road and stop until the vehicle has passed.""","""c""","""The DMV handbook states on page 45, 'Give the right-of-way to any law enforcement vehicle, fire engine, ambulance, or other emergency vehicle using a siren and red lights. Failure to pull over may result in a ticket. Drive to the right edge of the road and stop until the emergency vehicle(s) have passed.'""",45,easy
7,You see pedestrians near the road. You should:,"""a: Sound your horn and maintain your speed., b: Speed up to clear the area quickly., c: Slow down and pass with caution.""","""c""","""When you see animals or livestock near the road, slow down or stop and proceed when it is safe. Be sure to follow directions from the person in charge of the animals.""",45,easy
7,If you are driving and you see animals standing near the roadway:,"""a: Speed up to scare them away., b: Slow down and proceed with caution., c: Quickly swerve into the next lane.""","""b""","""If you see a sign with a picture of an animal, watch for animals on or near the road. If you see animals or livestock near the road, slow down or stop and proceed when it is safe.""",46,easy
7,"When used on roadways, bicycles are considered:","""a: Hazards., b: Vehicles., c: Dangerous.""","""b""","""Bicycles are considered 'vehicles' on roadways and share the same rights and responsibilities as other vehicles. This is clearly stated on page 46, where The DMV handbook says 'Bicyclists have the same rights and responsibilities as other drivers.'""",46,easy
7,You want to pass a bicyclist riding on the right edge of your lane. You,"""a: must honk your horn before passing the bicyclist, b: must not squeeze past the bicyclist, c: may not pass the bicyclist for any reason""","""b""","""The DMV handbook states, 'When you cannot change lanes to pass a bicyclist, allow at least three feet between your vehicle and the bicyclist. If you cannot give three feet of space, do not pass the cyclist until three feet of clearance can be given.'""",47,medium
7,When a bicyclist is making a left turn:,"""a: They may use the left lane., b: They may cut through all lanes., c: They may wait on the side of the road.""","""a""","""According to the DMV handbook, 'Bicyclists may… make left and right turns in the same way drivers do, using hand signals and turn lanes.'""",47,easy
7,Bicycle riders must,"""a: Ride facing traffic when there is no bike lane, b: Be given a safe amount of space when being passed by automobile drivers, c: Never walk the bicycle across the street""","""b""","""The DMV handbook states that drivers must leave at least three feet of space when passing a bicyclist. 'When you cannot change lanes to pass a bicyclist, allow at least three feet between your vehicle and the bicyclist. If you cannot give three feet of space, do not pass the cyclist until three feet of clearance can be given. This will help you avoid putting the bicyclist in danger.'""",48,easy
7,You want to pass a bicyclist riding on the right edge of your lane. You,"""a: Must not squeeze past the bicyclist, b: May not pass the bicyclist for any reason, c: Must honk your horn before passing the bicyclist""","""a""","""According to the DMV handbook, you must leave at least three feet of space between your vehicle and the bicyclist when passing. If you cannot give three feet of space, do not pass the cyclist until three feet of clearance can be given.  This means you must not squeeze past the bicyclist.""",48,medium
7,You are driving behind a motorcycle and want to pass. You must:,"""a: Stay in the right lane as much as possible because the motorcycle is small and doesn't use all of the lane., b: Blow your horn to make the motorcycle move onto the shoulder so that you can pass., c: Have your vehicle entirely in the left lane before and during the pass.""","""c""","""To safely pass a motorcycle that is in the travel lane you may need to change to another lane. In this case, pass safely then return to your original lane. Leave space between your vehicle and the bicyclist.""",48,medium
7,You want to pass a bicyclist in a narrow traffic lane when an oncoming vehicle is approaching. You should:,"""a: Honk your horn then pass the bicyclist., b: Slow down and let the vehicle pass you before you pass the bicyclist., c: Wait until the bicyclist rides off the roadway.""","""b""","""The DMV handbook states, 'When you cannot change lanes to pass a bicyclist, allow at least three feet between your vehicle and the bicyclist.'  Therefore, the best approach is to slow down and allow the oncoming vehicle to pass before attempting to pass the bicyclist.""",48,medium
7,"If you see orange construction signs and cones on a freeway, you must","""a: Slow down because the road ends, b: Be prepared for workers and slow moving equipment, c: Change lanes and maintain speed""","""b""","""You will see warning signs and message boards when there are workers, slow-moving equipment, and closed lanes ahead.  Go through the work zone carefully by: Slowing down.  Allowing extra space between vehicles. Expecting sudden slowing or stopping.  Watching for drivers changing lanes.  Avoiding distractions.""",49,easy
7,"If traffic light is red, but a police officer or fire fighter on duty tells you to go ahead, you should","""a: Wait for the green light, b: Do as he or she tells you, c: Report him or her to police""","""b""","""Obey any direction, order, or signal given by a law enforcement officer, or firefighter. Follow their orders even if they conflict with existing signs, signals, or laws.""",49,easy
7,Which sign on a truck means that the truck's load is potentially dangerous?,"""a: Octagonal., b: Diamond shaped., c: Rectangular wide., d: None of the above""","""b""","""A diamond-shaped sign on a truck means that the truck's load may be dangerous (gas, explosives etc.).""",49,medium
7,Drivers are required to obey instructions from:,"""a: Security guards patrolling parking lots., b: Other drivers whose vehicles are broken down on the roadway., c: Flaggers (signal persons) at construction sites.""","""c""","""The DMV handbook states, 'Obey special signs or instructions from workers such as flaggers.'""",49,easy
7,Fines in a construction zone are:,"""a: Doubled., b: Tripled., c: Cut in half.""","""a""","""The DMV handbook states on page 49, 'Fines are also doubled in highway construction or maintenance zones when workers are present.'""",49,easy
7,"If a traffic signal light is green and a police officer signals for you to stop, you should:","""a: Obey the officer., b: Obey the traffic signal., c: Do what the vehicle in front of you does.""","""a""","""According to page 49, 'Obey any direction, order, or signal given by a law enforcement officer, or firefighter. Follow their orders even if they conflict with existing signs, signals, or laws.'""",49,easy
7,"If you are continually being passed on the right and the left while driving in the center lane of an expressway, you should:","""a: Stay in the center lane., b: Move to the lane on your right., c: Move to the lane on your left.""","""b""","""According to the DMV handbook, on a multilane road, the passing lane is on the far left, and the right lane is used to enter or exit traffic.  The DMV handbook states that if you are driving slower than the flow of traffic, you should drive in the right lane. 'If you choose to drive slower than other traffic, drive in the right lane.' (Page 49)""",49,medium
7,"If you see orange construction signs and cones on a freeway, you must:","""a: Slow down because the lane ends ahead., b: Be prepared for workers and equipment ahead., c: Change lanes and maintain your current speed.""","""b""","""You will see warning signs and message boards when there are workers, slow-moving equipment, and closed lanes ahead. Go through the work zone carefully by: - Slowing down. - Allowing extra space between vehicles. - Expecting sudden slowing or stopping. - Watching for drivers changing lanes. - Avoiding distractions.""",49,easy
7,There is a vehicle stopped on the right shoulder of the road with its hazard lights on. You should:,"""a: Change lanes to the left and speed up., b: Slow down and pass very carefully., c: Stop your vehicle until you can see what has happened.""","""b""","""When approaching a stationary emergency vehicle with flashing emergency signal lights (hazard lights), move over and slow down.  If you are in an intersection when you see an emergency vehicle, continue through the intersection. Drive to the right as soon as it is safe and stop.""",49,easy
7,When driving in a construction zone:,"""a: Slightly increase your speed., b: Expect the unexpected., c: Expect construction workers to yield to motorists.""","""b""","""The DMV handbook states on page 49 that 'You will see warning signs and message boards when there are workers, slow-moving equipment, and closed lanes ahead.'  Thus, the answer is 'Expect the unexpected' which is synonymous with being prepared for any road conditions.""",49,easy
7,"When driving in work zones, you should:","""a: Increase your speed to get through the zone as quickly as possible., b: Reduce your speed and be prepared to stop suddenly., c: Maintain your normal speed the whole way through the zone.""","""b""","""The DMV handbook states, 'Go through the work zone carefully by: Slowing down., Allowing extra space between vehicles., Expecting sudden slowing or stopping.'""",49,easy
7,"When driving in work zones, you should:","""a: Follow the driver in front of you closely., b: Pass the driver in front of you as soon as you can., c: Avoid tailgating and keep a safe following distance.""","""c""","""The DMV handbook states on page 49, 'Go through the work zone carefully by: ... Allowing extra space between vehicles.'""",49,easy
7,Which of the following is a dangerous habit when driving in work zones?,"""a: Tailgating another vehicle, b: Failing to carefully watch for workers and moving equipment, c: Both of the above""","""c""","""Both tailgating and failing to carefully watch for workers and moving equipment are dangerous habits when driving in work zones. The DMV handbook states, 'Go through the work zone carefully by:  - Slowing down. - Allowing extra space between vehicles. - Expecting sudden slowing or stopping. - Watching for drivers changing lanes. - Avoiding distractions.'  Tailgating would violate the rule of allowing extra space between vehicles, and failing to watch for workers and equipment would violate the rule of expecting sudden slowing or stopping. """,49,easy
7,Which of the following is true about vehicles displaying a diamond-shaped sign that indicates a hazardous load?,"""a: They are not allowed to drive on freeways., b: They must stop before crossing railroad tracks., c: They are not allowed to exceed 35 mph.""","""b""","""According to the DMV handbook on page 49, 'Vehicles with these signs **must** stop before crossing railroad tracks.'""",49,medium
7,Which of these statements is true about roadwork zones?,"""a: Fines are the same for violations committed in work zones as they are under normal traffic conditions., b: You must ‘Slow for the Cone Zone’, c: Slow down only if you think workers are present.""","""b""","""The DMV Handbook states that drivers should 'Slow for the Cone Zone.' (page 49)""",49,easy
7,"Work zone barriers, drums, cones, and signs are used to:","""a: Make drivers angry about slow traffic., b: Inconvenience drivers., c: Keep traffic out of hazardous work zones.""","""c""","""Cones, drums, and barriers are used to keep traffic out of a hazardous work zone. 'Go through the work zone carefully by: Slowing down.' 'Cones, drums, or other barriers will guide you through the work zone.' """,49,easy
